{
  "schema_version": "0.2",
  "id": "forward-sm100-kernel-structure",
  "topic": "flash-attention-4",
  "title": "FlashAttention-4 forward · SM100 kernel structure",
  "subtitle": "Who does the work, which events connect the roles, and when SMEM/TMEM storage can be reused.",
  "architecture": "NVIDIA Blackwell SM100",
  "views": [
    {
      "id": "timeline",
      "renderer": "reconstruction-timeline",
      "output": "graphs/flash-attention-4/forward-sm100-kernel-structure.svg",
      "primary": true,
      "width": 4200
    }
  ],
  "configuration": [
    { "id": "path", "label": "path", "value": "dense TMA" },
    { "id": "q-stages", "label": "Q stages", "value": 2 },
    { "id": "kv-stages", "label": "KV stages", "value": 3 },
    { "id": "p-publish", "label": "P publish", "value": "96 + 32 cols" },
    { "id": "split-kv", "label": "split-KV", "value": false },
    { "id": "tile", "label": "tile", "value": "N=128, D=Dv=128" },
    { "id": "head-dim", "label": "D", "value": 128, "display": false },
    { "id": "head-dim-v", "label": "Dv", "value": 128, "display": false },
    { "id": "scope", "label": "scope", "value": "representative 1-CTA steady state" }
  ],
  "sources": [
    {
      "id": "fa4-forward-sm100",
      "label": "flash_attn/cute/flash_fwd_sm100.py",
      "url": "https://github.com/Dao-AILab/flash-attention/blob/main/flash_attn/cute/flash_fwd_sm100.py",
      "observed": "2026-08-01"
    }
  ],
  "timeline": {
    "start": 0,
    "end": 11.5,
    "label": "semantic event order · widths are not cycle-accurate",
    "sections": [
      { "id": "prologue", "label": "PROLOGUE", "start": 0, "end": 2.4 },
      { "id": "mainloop", "label": "MAINLOOP · REPEAT OVER j (ONE ITERATION + LOOP EXIT SHOWN)", "start": 2.4, "end": 9.4, "gap_before": 110 },
      { "id": "epilogue", "label": "EPILOGUE", "start": 9.4, "end": 11.5, "gap_before": 150 }
    ],
    "ticks": [
      { "at": 0, "label": "K₀ LOAD" },
      { "at": 1, "label": "Q₀ / Q₁" },
      { "at": 2, "label": "V₀ READY" },
      { "at": 3, "label": "QK₀ · Kⱼ" },
      { "at": 4, "label": "QK₁ / PREFETCH j+1" },
      { "at": 5, "label": "α₀ READY" },
      { "at": 6, "label": "EXP / α₁ READY" },
      { "at": 7, "label": "¾ P₀ → PV₀" },
      { "at": 8, "label": "¾ P₁ → PV₁" },
      { "at": 9, "label": "FINAL STATS" },
      { "at": 10, "label": "O FINAL" },
      { "at": 11.5, "label": "STORE" }
    ]
  },
  "loops": [
    {
      "id": "kv-loop",
      "label": "sequence-length K/V sweep",
      "section": "mainloop",
      "iterator": "j",
      "display": "representative-iteration",
      "indexing": {
        "mode": "concrete-prologue-symbolic-mainloop",
        "seed": 0,
        "adjacent": "next"
      },
      "evidence": [
        {
          "source": "fa4-forward-sm100",
          "locator": "lines 1661–1733",
          "note": "Q remains resident while the MMA loop advances through K/V blocks."
        }
      ]
    }
  ],
  "events": [
    {
      "id": "q-loop-release",
      "kind": "release",
      "at": 9.4,
      "label": "Q₀/Q₁ reusable after K/V loop",
      "mechanism": "pipeline_q.consumer_release_w_index(stage)",
      "scope": "kv-loop",
      "evidence": [
        {
          "source": "fa4-forward-sm100",
          "locator": "lines 1731–1733",
          "note": "Both Q stages are released only after the sequence-length loop exits."
        }
      ]
    }
  ],
  "roles": [
    {
      "id": "load",
      "label": "Load producer",
      "warps": "warp 14",
      "responsibility": "Issue TMA Q/K/V loads into staged SMEM"
    },
    {
      "id": "mma",
      "label": "MMA issuer",
      "warps": "warp 12",
      "responsibility": "Issue tcgen05 QK and PV; own TMEM allocation"
    },
    {
      "id": "softmax0",
      "label": "Softmax · Q stage 0",
      "warps": "warps 0–3",
      "responsibility": "Load S; mask + online max/sum; publish α and split P"
    },
    {
      "id": "softmax1",
      "label": "Softmax · Q stage 1",
      "warps": "warps 4–7",
      "responsibility": "Same softmax program, staggered behind Q stage 0"
    },
    {
      "id": "correction",
      "label": "Output correction",
      "warps": "warps 8–11",
      "responsibility": "Rescale prior O and finalize TMEM O into SMEM"
    },
    {
      "id": "epilogue",
      "label": "Output store",
      "warps": "warp 13",
      "responsibility": "Consume staged SMEM O and publish GMEM output"
    }
  ],
  "operations": [
    {
      "id": "load-q0",
      "role": "load",
      "kind": "load",
      "stage": 0,
      "start": 0.6,
      "end": 1.2,
      "label": "TMA Q₀",
      "detail": "GMEM → sQ[0]",
      "writes": ["sq0"]
    },
    {
      "id": "load-q1",
      "role": "load",
      "kind": "load",
      "stage": 1,
      "start": 1.2,
      "end": 1.8,
      "label": "TMA Q₁",
      "detail": "GMEM → sQ[1]",
      "writes": ["sq1"]
    },
    {
      "id": "load-k",
      "role": "load",
      "kind": "load",
      "start": 0,
      "end": 0.6,
      "label": "TMA K₀",
      "detail": "GMEM → current K slot",
      "iteration": { "loop": "kv-loop", "position": "seed", "objects": ["K"] },
      "writes": ["skj"]
    },
    {
      "id": "load-v",
      "role": "load",
      "kind": "load",
      "start": 1.8,
      "end": 2.4,
      "label": "TMA V₀",
      "detail": "GMEM → current V slot",
      "iteration": { "loop": "kv-loop", "position": "seed", "objects": ["V"] },
      "writes": ["svj"]
    },
    {
      "id": "load-k-next",
      "role": "load",
      "kind": "load",
      "stage": "next-kv",
      "scope": "kv-loop",
      "frequency": "each-iteration",
      "start": 3.6,
      "end": 4.2,
      "label": "TMA Kⱼ₊₁",
      "detail": "prefetch → KV ring slot 2",
      "iteration": { "loop": "kv-loop", "position": "next", "objects": ["K"] },
      "writes": ["skj1"]
    },
    {
      "id": "load-v-next",
      "role": "load",
      "kind": "load",
      "stage": "next-kv",
      "scope": "kv-loop",
      "frequency": "each-iteration",
      "start": 4.2,
      "end": 4.8,
      "label": "TMA Vⱼ₊₁",
      "detail": "prefetch → released slot 0",
      "iteration": { "loop": "kv-loop", "position": "next", "objects": ["V"] },
      "writes": ["svj1"]
    },
    {
      "id": "mma-wait-q0",
      "role": "mma",
      "kind": "wait",
      "start": 1.65,
      "end": 2.4,
      "label": "wait Q₀/K"
    },
    {
      "id": "mma-qk0",
      "role": "mma",
      "kind": "mma",
      "stage": 0,
      "scope": "kv-loop",
      "frequency": "each-iteration",
      "start": 2.4,
      "end": 3.15,
      "label": "tcgen05 QK₀",
      "detail": "sQ[0] × sKⱼ → TMEM S₀",
      "iteration": { "loop": "kv-loop", "position": "current", "objects": ["K"] },
      "reads": ["sq0", "skj"],
      "writes": ["ts0"]
    },
    {
      "id": "mma-qk1",
      "role": "mma",
      "kind": "mma",
      "stage": 1,
      "scope": "kv-loop",
      "frequency": "each-iteration",
      "start": 3.15,
      "end": 3.9,
      "label": "tcgen05 QK₁",
      "detail": "sQ[1] × sKⱼ → TMEM S₁",
      "iteration": { "loop": "kv-loop", "position": "current", "objects": ["K"] },
      "reads": ["sq1", "skj"],
      "writes": ["ts1"]
    },
    {
      "id": "mma-wait-p0",
      "role": "mma",
      "kind": "wait",
      "scope": "kv-loop",
      "frequency": "each-iteration",
      "start": 6.15,
      "end": 6.45,
      "label": "acquire ¾ P₀ + O₀"
    },
    {
      "id": "mma-pv0",
      "role": "mma",
      "kind": "mma",
      "stage": 0,
      "scope": "kv-loop",
      "frequency": "each-iteration",
      "start": 6.45,
      "end": 7.45,
      "label": "tcgen05 PV₀",
      "detail": "P₀ × Vⱼ; issue after ¾ P; final ¼ mbar",
      "iteration": { "loop": "kv-loop", "position": "current", "objects": ["V"] },
      "reads": ["tp0", "svj", "to0"],
      "writes": ["to0"]
    },
    {
      "id": "mma-pv1",
      "role": "mma",
      "kind": "mma",
      "stage": 1,
      "scope": "kv-loop",
      "frequency": "each-iteration",
      "start": 7.45,
      "end": 8.55,
      "label": "tcgen05 PV₁",
      "detail": "P₁ × Vⱼ; issue after ¾ P; final ¼ mbar",
      "iteration": { "loop": "kv-loop", "position": "current", "objects": ["V"] },
      "reads": ["tp1", "svj", "to1"],
      "writes": ["to1"]
    },
    {
      "id": "soft0-wait",
      "role": "softmax0",
      "kind": "wait",
      "scope": "kv-loop",
      "frequency": "each-iteration",
      "start": 2.85,
      "end": 3.2,
      "label": "wait S₀"
    },
    {
      "id": "soft0-load-s",
      "role": "softmax0",
      "kind": "transfer",
      "stage": 0,
      "scope": "kv-loop",
      "frequency": "each-iteration",
      "start": 3.2,
      "end": 3.8,
      "label": "TMEM S₀ → regs",
      "detail": "tcgen05.ld 32×32b",
      "reads": ["ts0"],
      "evidence": [
        {
          "source": "fa4-forward-sm100",
          "locator": "lines 2202–2214",
          "note": "Softmax waits for S and copies its TMEM score tile into registers."
        }
      ]
    },
    {
      "id": "soft0-rowmax",
      "role": "softmax0",
      "kind": "compute",
      "stage": 0,
      "scope": "kv-loop",
      "frequency": "each-iteration",
      "start": 3.8,
      "end": 4.55,
      "label": "mask + row max",
      "detail": "update m₀; compute α₀",
      "writes": ["sstats"],
      "evidence": [
        {
          "source": "fa4-forward-sm100",
          "locator": "lines 2215–2244",
          "note": "The score modifier and mask precede the online row-max update and accumulator scale."
        }
      ]
    },
    {
      "id": "soft0-publish-scale",
      "role": "softmax0",
      "kind": "transfer",
      "stage": 0,
      "scope": "kv-loop",
      "frequency": "each-iteration",
      "start": 4.55,
      "end": 4.9,
      "label": "publish α₀",
      "detail": "sScale + named barrier",
      "reads": ["sstats"],
      "writes": ["sstats"],
      "evidence": [
        {
          "source": "fa4-forward-sm100",